{
  "id": "5b9d0d2e-6c1e-4f6a-9d1e-1b2c3d4e5f60",
  "type": "identity.user.reactivated",
  "schemaVersion": 1,
  "occurredAt": "2026-09-19T12:00:00Z",
  "user": {
    "id": "0f2b7c1a-3d4e-4f5a-8b6c-7d8e9f0a1b2c",
    "email": "ada@example.com",
    "name": "Ada Example",
    "active": true,
    "version": 4
  }
}
